{
  "candidate": {
    "branch": "codex/slice10-provider-conformance-lead-20260923",
    "commit_sha": null,
    "freeze_record_location": "Exact frozen commit/tree will be recorded in the GitHub #53 candidate receipt and Draft PR after commit.",
    "freeze_state": "not_frozen_at_matrix_observation",
    "tree_sha": null
  },
  "ci_observation": {
    "candidate_hosted_ci": "No hosted run exists for this not-yet-frozen candidate at matrix observation.",
    "green_claim": false,
    "related_main_or_prior_run": "Current live main run 35889012451 failed before candidate steps: runner_id 0, steps [], billing annotation says recent payments failed or spending limit needs increase. Prior Draft #72 run 35925726306 also had runner_id 0 and zero steps; its cause is unknown from retained GitHub run data. Neither is candidate execution evidence."
  },
  "claim_scope": "For the exact installed runtime versions and exercised interfaces, provider outcomes describe native runtime behavior and Conduit outcomes describe the adapter/lifecycle boundary. Each cell links runtime receipts and, where used, current source/test evidence. This is implementation and local qualification evidence, not independent terminal qualification or universal compatibility.",
  "controls": {
    "explicitly_unsupported": {
      "evidence_refs": [
        "PR63-LIFECYCLE",
        "LIFECYCLE-PLANNER",
        "CODEX-NEGATIVE"
      ],
      "note": "Structured Codex/ACP/CLI adapters have no Conduit release/detach path; direct PTY cannot detach. The installed Codex server also rejected interrupt without exact turnId, and the repaired exact-ID request later passed.",
      "result": "unsupported"
    },
    "positive_observation": {
      "evidence_refs": [
        "OPENCODE-NATIVE",
        "CODEX-NATIVE",
        "GROK-NATIVE",
        "SHELL-PTY"
      ],
      "note": "Real scoped discovery, exact identity/resume, active-turn cancellation or OS process-tree/stop properties were observed on qualification-owned resources.",
      "result": "supported"
    },
    "provider_semantic_difference": {
      "evidence_refs": [
        "OPENCODE-NATIVE",
        "CODEX-NATIVE",
        "GROK-NATIVE"
      ],
      "note": "OpenCode reports session busy/idle without a turn ID; Codex reports exact thread and turn IDs/status; Grok ACP reports session-level stopReason cancelled with no turn ID.",
      "result": "provider_specific"
    },
    "unavailable_runtime": {
      "evidence_refs": [
        "ENV-INVENTORY"
      ],
      "note": "Claude Code is installed but its own read-only auth status says loggedIn=false and authMethod=none; no prompt/session was attempted.",
      "result": "unavailable"
    },
    "unknown_authority": {
      "evidence_refs": [
        "CODEX-NATIVE",
        "ENV-INVENTORY"
      ],
      "note": "The exact-cwd Codex thread list was empty before its first turn. This pre-turn absence is preserved as unknown; later scoped discovery after a turn passed.",
      "result": "unknown"
    }
  },
  "credential_values_recorded": false,
  "evidence_catalog": {
    "ACP-ADAPTER": {
      "artifact": {
        "path": "Sources/Conduit/GrokACPClient.swift",
        "sha256": "be5a39358df68c6311637ad2dae09bfac083c37044ffcb18982c3d2914f8994f"
      },
      "authority": "read-only source and test inspection in the candidate checkout",
      "freshness": "current candidate source snapshot; not a provider runtime observation",
      "identity": {
        "path": "Sources/Conduit/GrokACPClient.swift"
      },
      "kind": "source_test",
      "limitation": "The generic ACP client is configured with provider-specific launch/auth behavior; the direct Grok run is the runtime authority.",
      "observed_at_utc": "2026-09-23T23:07:42Z",
      "procedure_id": "acp-adapter-source-v1"
    },
    "ACP-PROTOCOL": {
      "artifact": {
        "path": "Sources/ConduitCore/ACPProtocol.swift",
        "sha256": "496ca6fdae99d5735d38a61fd00dc5fc22d1d0ec6ca4d90cecf40b42834591af"
      },
      "authority": "read-only source and test inspection in the candidate checkout",
      "freshness": "current candidate source snapshot; not a provider runtime observation",
      "identity": {
        "path": "Sources/ConduitCore/ACPProtocol.swift"
      },
      "kind": "source_test",
      "limitation": "ACP permission and event mapping are adapter-level; the installed Grok permission path was not triggered.",
      "observed_at_utc": "2026-09-23T23:07:42Z",
      "procedure_id": "acp-protocol-source-v1"
    },
    "CODEX-ADAPTER": {
      "artifact": {
        "path": "Sources/Conduit/CodexAppServerClient.swift",
        "sha256": "bb70c445990b9050c23ed8ad9b3bb3e42a69c7f499b39ea4d2775a0db011063f"
      },
      "authority": "read-only source and test inspection in the candidate checkout",
      "freshness": "current candidate source snapshot; not a provider runtime observation",
      "identity": {
        "path": "Sources/Conduit/CodexAppServerClient.swift"
      },
      "kind": "source_test",
      "limitation": "Current adapter captures active turn ID and requires exact thread and turn IDs for interrupt.",
      "observed_at_utc": "2026-09-23T23:07:42Z",
      "procedure_id": "codex-app-server-adapter-source-v1"
    },
    "CODEX-FIX-TEST": {
      "artifact": {
        "path": "Tests/ConduitCoreTests/CodexAppServerProtocolTests.swift",
        "sha256": "c16be21db8e6059662cd8cf337a5d80d63d03f6db7b6d272c85bc5eb8d154e15"
      },
      "authority": "read-only source and test inspection in the candidate checkout",
      "freshness": "current candidate source snapshot; not a provider runtime observation",
      "identity": {
        "path": "Tests/ConduitCoreTests/CodexAppServerProtocolTests.swift"
      },
      "kind": "source_test",
      "limitation": "Deterministic protocol tests accompany the direct installed-runtime interrupted-turn receipt.",
      "observed_at_utc": "2026-09-23T23:07:42Z",
      "procedure_id": "codex-turn-id-interrupt-regression-test-v1"
    },
    "CODEX-FIX-TEST-RUN": {
      "artifact": {
        "path": "docs/qualification/receipts/codex-protocol-tests-v1-20260923T231911Z.json",
        "sha256": "b0a766cda5f2fc42e223845dac56295ed0fcd2790314f1117f12c1d8ab0feaf4"
      },
      "authority": "Xcode XCTest on the exact candidate worktree; Codex App Server protocol suite only",
      "freshness": "fresh local test run before candidate freeze",
      "identity": {
        "exit_code": 0,
        "suite": "CodexAppServerProtocolTests",
        "tests_executed": 17
      },
      "kind": "source_test",
      "limitation": "Focused deterministic regression tests; the separate direct App Server runtime receipt verifies the exact turn/interrupt boundary.",
      "observed_at_utc": "2026-09-23T23:19:11.455Z",
      "procedure_id": "codex-exact-turn-interrupt-regression-v1"
    },
    "CODEX-NATIVE": {
      "artifact": {
        "path": "docs/qualification/receipts/codex-app-server-probe-v1-20260923T222811Z.json",
        "sha256": "b2ed0808948e2a2b3e0c6fc104f3162bd166143050c29440b0b19241084b478c"
      },
      "authority": "Authenticated Codex App Server stdio in a unique empty cwd; all thread lists used the exact cwd; only the qualification thread was resumed and archived",
      "freshness": "fresh direct observation",
      "identity": {
        "provider_host_pids": [
          50173,
          50207
        ],
        "provider_thread_id": "01a0d062-289f-78d0-a46b-c0e89e3ed33f",
        "provider_turn_id": "01a0d062-2d3f-70c0-a378-715bb6a5fc7b"
      },
      "kind": "runtime_probe",
      "limitation": "One exact thread and turn were used. The pre-turn cwd-filtered list was empty; no account-wide listing or file-change/diff probe was run.",
      "observed_at_utc": "2026-09-23T22:28:11.329Z",
      "procedure_id": "codex-app-server-isolated-thread-v1"
    },
    "CODEX-NEGATIVE": {
      "artifact": {
        "path": "docs/qualification/receipts/codex-app-server-probe-v1-20260923T221922Z.json",
        "sha256": "d73cbf598aa7d2b99e8607975c06c1fb3a535f0e50f6c61ac898ad668fde1789"
      },
      "authority": "Qualification-owned Codex App Server thread and turn; attempted turn/interrupt without turnId",
      "freshness": "fresh direct observation",
      "identity": {
        "provider_thread_id": "01a0d062-26ed-7a63-9a88-4389d5516289",
        "provider_turn_id": "01a0d062-2a7d-7430-bc4a-85978b0f1bb0"
      },
      "kind": "negative_probe",
      "limitation": "The exact runtime rejected the incomplete request with missing field turnId. That call was a preserved negative control; a later exact-id call succeeded.",
      "observed_at_utc": "2026-09-23T22:19:22.438Z",
      "procedure_id": "codex-interrupt-missing-turn-id-v1"
    },
    "CODEX-PROTOCOL": {
      "artifact": {
        "path": "Sources/ConduitCore/CodexAppServerProtocol.swift",
        "sha256": "18b661335b7a911e4eda2d33fa5147e2fcb7cbb38d15f78d00e96a52ac63f9b7"
      },
      "authority": "read-only source and test inspection in the candidate checkout",
      "freshness": "current candidate source snapshot; not a provider runtime observation",
      "identity": {
        "path": "Sources/ConduitCore/CodexAppServerProtocol.swift"
      },
      "kind": "source_test",
      "limitation": "Current protocol mapper/request builder preserves exact active turn identity.",
      "observed_at_utc": "2026-09-23T23:07:42Z",
      "procedure_id": "codex-app-server-protocol-source-v1"
    },
    "CODEX-STREAM-TESTS": {
      "artifact": {
        "path": "Tests/ConduitCoreTests/CodexAppServerStreamPumpTests.swift",
        "sha256": "74ca21e897ec80f984d79af12649e5dd611a3b2058afb87b2947bf7a398cef81"
      },
      "authority": "read-only source and test inspection in the candidate checkout",
      "freshness": "current candidate source snapshot; not a provider runtime observation",
      "identity": {
        "path": "Tests/ConduitCoreTests/CodexAppServerStreamPumpTests.swift"
      },